<?xml version="1.0" encoding="UTF-8"?>
<list xmlns:xsi="http://www.w3.org/2001/XMLSchema-instance" xsi:noNamespaceSchemaLocation="../../xsd/skills.xsd">
	<skill id="21000" levels="1" name="Release Seal on Agathion - Majo">
		<!-- Confirmed CT2.5 -->
		<set name="hitTime" val="3000" />
		<set name="isMagic" val="2" /> <!-- Static Skill -->
		<set name="magicLvl" val="85" />
		<set name="npcId" val="1501" />
		<set name="operateType" val="A1" />
		<set name="targetType" val="SELF" />
		<for>
			<effect name="SummonAgathion" noicon="1" val="0" />
		</for>
	</skill>
	<skill id="21001" levels="1" name="Release Seal on Agathion - Gold Majo">
		<!-- Confirmed CT2.5 -->
		<set name="hitTime" val="3000" />
		<set name="isMagic" val="2" /> <!-- Static Skill -->
		<set name="magicLvl" val="85" />
		<set name="npcId" val="1502" />
		<set name="operateType" val="A1" />
		<set name="targetType" val="SELF" />
		<for>
			<effect name="SummonAgathion" noicon="1" val="0" />
		</for>
	</skill>
	<skill id="21002" levels="1" name="Release Seal on Agathion - Black Majo">
		<!-- Confirmed CT2.5 -->
		<set name="hitTime" val="3000" />
		<set name="isMagic" val="2" /> <!-- Static Skill -->
		<set name="magicLvl" val="85" />
		<set name="npcId" val="1503" />
		<set name="operateType" val="A1" />
		<set name="targetType" val="SELF" />
		<for>
			<effect name="SummonAgathion" noicon="1" val="0" />
		</for>
	</skill>
	<skill id="21003" levels="1" name="Release Seal on Agathion - Plaipitak">
		<!-- Confirmed CT2.5 -->
		<set name="hitTime" val="3000" />
		<set name="isMagic" val="2" /> <!-- Static Skill -->
		<set name="magicLvl" val="85" />
		<set name="npcId" val="1504" />
		<set name="operateType" val="A1" />
		<set name="targetType" val="SELF" />
		<for>
			<effect name="SummonAgathion" noicon="1" val="0" />
		</for>
	</skill>
	<skill id="21004" levels="1" name="Wind Walk">
		<set name="abnormalLvl" val="26" />
		<set name="abnormalTime" val="120" />
		<set name="abnormalType" val="SPEED_UP" />
		<set name="hitTime" val="4000" />
		<set name="isMagic" val="2" /> <!-- Static Skill -->
		<set name="operateType" val="A2" />
		<set name="reuseDelay" val="1080000" />
		<set name="skillType" val="BUFF" />
		<set name="targetType" val="SELF" />
		<for>
			<effect name="Buff" val="0">
				<add order="0x40" stat="runSpd" val="20" />
			</effect>
		</for>
	</skill>
	<skill id="21005" levels="1" name="Agility">
		<set name="abnormalLvl" val="26" />
		<set name="abnormalTime" val="3600" />
		<set name="abnormalType" val="AVOID_UP" />
		<set name="hitTime" val="4000" />
		<set name="isMagic" val="2" /> <!-- Static Skill -->
		<set name="operateType" val="A2" />
		<set name="reuseDelay" val="86400000" />
		<set name="skillType" val="BUFF" />
		<set name="targetType" val="SELF" />
		<for>
			<effect name="Buff" val="0">
				<add order="0x40" stat="rEvas" val="4" />
			</effect>
		</for>
	</skill>
	<skill id="21006" levels="1" name="Large Firework Effect">
		<set name="isMagic" val="2" /> <!-- Static Skill -->
		<set name="magicLvl" val="1" />
		<set name="operateType" val="A1" />
		<set name="reuseDelay" val="3600000" />
		<set name="skillType" val="NOTDONE" />
		<set name="targetType" val="NONE" />
	</skill>
	<skill id="21007" levels="1" name="Ability of Doubt">
		<!-- Confirmed CT2.5 -->
		<set name="abnormalTime" val="600" />
		<set name="abnormalLvl" val="0" />
		<set name="abnormalType" val="BIG_HEAD" />
		<set name="isMagic" val="2" /> <!-- Static Skill -->
		<set name="operateType" val="A2" />
		<set name="reuseDelay" val="3600000" />
		<set name="skillType" val="BUFF" />
		<set name="targetType" val="SELF" />
		<set name="trait" val="ETC" />
		<for>
			<effect name="BigHead" val="0" abnormalVisualEffect="bighead" />
		</for>
	</skill>
	<skill id="21008" levels="1" name="Release Seal on Agathion - Baby Panda">
		<!-- Confirmed CT2.5 -->
		<set name="hitTime" val="3000" />
		<set name="isMagic" val="2" /> <!-- Static Skill -->
		<set name="magicLvl" val="85" />
		<set name="npcId" val="1505" />
		<set name="operateType" val="A1" />
		<set name="targetType" val="SELF" />
		<for>
			<effect name="SummonAgathion" noicon="1" val="0" />
		</for>
	</skill>
	<skill id="21009" levels="1" name="Release Seal on Agathion - Bamboo Panda">
		<!-- Confirmed CT2.5 -->
		<set name="hitTime" val="3000" />
		<set name="isMagic" val="2" /> <!-- Static Skill -->
		<set name="magicLvl" val="85" />
		<set name="npcId" val="1506" />
		<set name="operateType" val="A1" />
		<set name="targetType" val="SELF" />
		<for>
			<effect name="SummonAgathion" noicon="1" val="0" />
		</for>
	</skill>
	<skill id="21010" levels="1" name="Release Seal on Agathion - Sexy Panda">
		<!-- Confirmed CT2.5 -->
		<set name="hitTime" val="3000" />
		<set name="isMagic" val="2" /> <!-- Static Skill -->
		<set name="magicLvl" val="85" />
		<set name="npcId" val="1507" />
		<set name="operateType" val="A1" />
		<set name="targetType" val="SELF" />
		<for>
			<effect name="SummonAgathion" noicon="1" val="0" />
		</for>
	</skill>
	<skill id="21011" levels="1" name="Energy Recovery">
		<!-- Recovers energy when acquiring Exp. for 20 minutes -->
		<set name="abnormalLvl" val="26" />
		<set name="abnormalTime" val="1200" />
		<set name="abnormalType" val="VP_UP" />
		<set name="hitTime" val="4000" />
		<set name="isMagic" val="2" /> <!-- Static Skill -->
		<set name="operateType" val="A2" />
		<set name="reuseDelay" val="43200000" />
		<set name="skillType" val="BUFF" />
		<set name="targetType" val="SELF" />
		<for>
			<effect name="Buff" val="0" abnormalVisualEffect="vitality">
				<sub order="0x40" stat="vitalityConsumeRate" val="10" />
			</effect>
		</for>
	</skill>
	<skill id="21012" levels="1" name="Energy Recovery">
		<!-- Recovers energy when acquiring Exp. for 20 minutes -->
		<set name="abnormalLvl" val="26" />
		<set name="abnormalTime" val="1200" />
		<set name="abnormalType" val="VP_UP" />
		<set name="hitTime" val="4000" />
		<set name="isMagic" val="2" /> <!-- Static Skill -->
		<set name="operateType" val="A2" />
		<set name="reuseDelay" val="43200000" />
		<set name="skillType" val="BUFF" />
		<set name="targetType" val="SELF" />
		<for>
			<effect name="Buff" val="0" abnormalVisualEffect="vitality">
				<sub order="0x40" stat="vitalityConsumeRate" val="10" />
			</effect>
		</for>
	</skill>
	<skill id="21013" levels="1" name="Energy Recovery">
		<!-- Recovers energy when acquiring Exp. for 20 minutes -->
		<set name="abnormalLvl" val="26" />
		<set name="abnormalTime" val="1200" />
		<set name="abnormalType" val="VP_UP" />
		<set name="hitTime" val="4000" />
		<set name="isMagic" val="2" /> <!-- Static Skill -->
		<set name="operateType" val="A2" />
		<set name="reuseDelay" val="43200000" />
		<set name="skillType" val="BUFF" />
		<set name="targetType" val="SELF" />
		<for>
			<effect name="Buff" val="0" abnormalVisualEffect="vitality">
				<sub order="0x40" stat="vitalityConsumeRate" val="10" />
			</effect>
		</for>
	</skill>
	<skill id="21014" levels="1" name="Scissors">
		<set name="castRange" val="400" />
		<set name="coolTime" val="500" />
		<set name="effectRange" val="500" />
		<set name="hitTime" val="2000" />
		<set name="isMagic" val="2" /> <!-- Static Skill -->
		<set name="magicLvl" val="1" />
		<set name="operateType" val="A1" />
		<set name="targetType" val="ONE" />
		<cond msgId="109">
			<target npcId="13183" />
		</cond>
	</skill>
	<skill id="21015" levels="1" name="Rock">
		<set name="castRange" val="400" />
		<set name="coolTime" val="500" />
		<set name="hitTime" val="2000" />
		<set name="isMagic" val="2" /> <!-- Static Skill -->
		<set name="magicLvl" val="1" />
		<set name="operateType" val="A1" />
		<set name="targetType" val="ONE" />
		<cond msgId="109">
			<target npcId="13183" />
		</cond>
	</skill>
	<skill id="21016" levels="1" name="Paper">
		<set name="castRange" val="400" />
		<set name="coolTime" val="500" />
		<set name="hitTime" val="2000" />
		<set name="isMagic" val="2" /> <!-- Static Skill -->
		<set name="magicLvl" val="1" />
		<set name="operateType" val="A1" />
		<set name="targetType" val="ONE" />
		<cond msgId="109">
			<target npcId="13183" />
		</cond>
	</skill>
	<skill id="21017" levels="1" name="Holiday Dream Weapon">
		<set name="magicLvl" val="1" />
		<set name="operateType" val="P" />
		<set name="targetType" val="SELF" />
		<for>
			<mul order="0x30" stat="maxCp" val="1.3" />
			<add order="0x40" stat="rCrit" val="100" />
			<add order="0x40" stat="absorbDam" val="10" />
		</for>
	</skill>
	<skill id="21018" levels="1" name="Holiday Dream Weapon">
		<set name="magicLvl" val="1" />
		<set name="operateType" val="P" />
		<set name="targetType" val="SELF" />
		<for>
			<mul order="0x30" stat="maxCp" val="1.3" />
			<add order="0x40" stat="rCrit" val="100" />
			<mul order="0x30" stat="cAtk" val="1.25" />
		</for>
	</skill>
	<skill id="21019" levels="1" name="Holiday Dream Weapon">
		<set name="magicLvl" val="1" />
		<set name="operateType" val="P" />
		<set name="targetType" val="SELF" />
		<for>
			<mul order="0x30" stat="maxCp" val="1.3" />
			<mul order="0x30" stat="blowRate" val="1.25" />
			<mul order="0x30" stat="MagicalMpConsumeRate" val="0.8" />
		</for>
	</skill>
	<skill id="21020" levels="1" name="Holiday Dream Weapon">
		<set name="magicLvl" val="1" />
		<set name="operateType" val="P" />
		<set name="targetType" val="SELF" />
		<for>
			<mul order="0x30" stat="maxCp" val="1.3" />
			<add order="0x40" stat="rCrit" val="100" />
			<add order="0x40" stat="absorbDam" val="10" />
		</for>
	</skill>
	<skill id="21021" levels="1" name="Holiday Dream Weapon">
		<set name="magicLvl" val="1" />
		<set name="operateType" val="P" />